{
  "ControlType": "Button",
  "Name": "Submit Order",
  "AutomationId": "btn-submit-old",
  "ClassName": "",
  "BoundingRectangle": {
    "X": 100,
    "Y": 200,
    "Width": 120,
    "Height": 35,
    "IsUsable": true,
    "IsEmpty": false
  },
  "ParentControlType": "Form",
  "ParentAutomationId": "",
  "SiblingIndex": 0,
  "SiblingCount": 0,
  "TestIntent": "",
  "Children": [],
  "ChildControlTypeSignature": null
}